{
  "schemaVersion": "1.0.0",
  "source": "Expert-curated public catalogs for Indian parents 33–50. Official platforms only. Impact scores are editorial, not a clinical claim.",
  "audience": { "ageMin": 33, "ageMax": 50, "region": "IN" },
  "items": [
    {
      "id": "social-dilemma",
      "n": 1,
      "title": "The Social Dilemma",
      "category": "movies",
      "format": "film",
      "durationMin": 94,
      "languages": ["en"],
      "goals": ["parenting", "learning"],
      "impactScore": 88,
      "why": "How feeds shape attention — useful before you hand a child a phone.",
      "evidence": "Documentary interviews with former platform designers; pair with family screen rules.",
      "indiaNote": "Watch on Netflix IN. Debrief: one family phone-free meal.",
      "url": "https://www.netflix.com/title/81254224",
      "platform": "Netflix"
    },
    {
      "id": "inside-bills-brain",
      "n": 2,
      "title": "Inside Bill’s Brain",
      "category": "movies",
      "format": "series",
      "durationMin": 56,
      "languages": ["en"],
      "goals": ["learning", "career"],
      "impactScore": 82,
      "why": "Innovation, philanthropy, and first-principles problem solving.",
      "evidence": "Docuseries on large-scale problem framing (sanitation, energy).",
      "indiaNote": "Netflix IN. One episode + one note: what problem would I fund at home?",
      "url": "https://www.netflix.com/title/80184771",
      "platform": "Netflix"
    },
    {
      "id": "minimalism-doc",
      "n": 3,
      "title": "Minimalism: A Documentary About the Important Things",
      "category": "health",
      "format": "film",
      "durationMin": 78,
      "languages": ["en"],
      "goals": ["health", "wealth"],
      "impactScore": 74,
      "why": "Lifestyle clarity and less consumption — useful in a high-GST, high-stuff household.",
      "evidence": "Values-based spending, not a finance course.",
      "indiaNote": "YouTube / rental. Try a 7-day no-new-Amazon rule.",
      "url": "https://www.youtube.com/results?search_query=Minimalism+A+Documentary+About+the+Important+Things+official",
      "platform": "YouTube"
    },
    {
      "id": "money-heist-making",
      "n": 4,
      "title": "La Casa de Papel: The Phenomenon (making-of)",
      "category": "movies",
      "format": "film",
      "durationMin": 57,
      "languages": ["en", "hi"],
      "goals": ["career", "learning"],
      "impactScore": 68,
      "why": "Team craft, pacing, and collaboration — entertainment with a work lesson.",
      "evidence": "Behind-the-scenes craft, not a crime how-to.",
      "indiaNote": "Netflix IN. Ask: who is the ‘Professor’ in our family week?",
      "url": "https://www.netflix.com/title/81040370",
      "platform": "Netflix"
    },
    {
      "id": "chak-de-lagaan",
      "n": 5,
      "title": "Chak De! India / Lagaan",
      "category": "movies",
      "format": "film",
      "durationMin": 150,
      "languages": ["hi"],
      "goals": ["career", "parenting"],
      "impactScore": 86,
      "why": "Indian classics on leadership, grit, and team identity.",
      "evidence": "Widely used in Indian B-school case conversations on motivation.",
      "indiaNote": "Family film night. One question after: what did the captain do when the team lost?",
      "url": "https://www.youtube.com/results?search_query=Chak+De+India+official+trailer",
      "platform": "YouTube / Prime"
    },
    {
      "id": "coursera-ai-psych",
      "n": 6,
      "title": "Coursera / edX — AI, finance, psychology",
      "category": "learning",
      "format": "course",
      "durationMin": 25,
      "languages": ["en"],
      "goals": ["learning", "career", "wealth"],
      "impactScore": 90,
      "why": "Structured skill hours beat random YouTube. Audit one course at a time.",
      "evidence": "MOOCs with assessments; pick Yale ‘Science of Well-Being’ or a Python/AI intro.",
      "indiaNote": "Many have audit-for-free. Sunday 25 minutes, not a 12-week binge.",
      "url": "https://www.coursera.org",
      "platform": "Coursera"
    },
    {
      "id": "crash-course",
      "n": 7,
      "title": "Crash Course Philosophy & Economics",
      "category": "learning",
      "format": "clip",
      "durationMin": 12,
      "languages": ["en"],
      "goals": ["learning", "wealth"],
      "impactScore": 84,
      "why": "Dense, cited explainers. Good for a commute.",
      "evidence": "Classroom-tested YouTube EDU series.",
      "indiaNote": "Turn autoplay off. One episode, one sentence in notes.",
      "url": "https://www.youtube.com/@crashcourse",
      "platform": "YouTube"
    },
    {
      "id": "ted-nayi-soch",
      "n": 8,
      "title": "TED Talks India Nayi Soch",
      "category": "learning",
      "format": "clip",
      "durationMin": 18,
      "languages": ["hi", "en"],
      "goals": ["learning", "career"],
      "impactScore": 80,
      "why": "Ideas in Hindi/English with Indian context — not only Silicon Valley frames.",
      "evidence": "TED editorial format; pick talks on education, cities, work.",
      "indiaNote": "Star/YouTube. Share one talk at dinner, not a lecture.",
      "url": "https://www.youtube.com/results?search_query=TED+Talks+India+Nayi+Soch",
      "platform": "YouTube"
    },
    {
      "id": "masterclass-lead",
      "n": 9,
      "title": "MasterClass — leadership, negotiation, creativity",
      "category": "learning",
      "format": "course",
      "durationMin": 20,
      "languages": ["en"],
      "goals": ["career", "learning"],
      "impactScore": 76,
      "why": "Craft from practitioners. Optional paid; skip if budget is tight and use Stanford GSB instead.",
      "evidence": "Practitioner lessons, not peer-reviewed.",
      "indiaNote": "If you skip the paywall, use the free Stanford GSB item in this pack.",
      "url": "https://www.masterclass.com",
      "platform": "MasterClass"
    },
    {
      "id": "stanford-gsb",
      "n": 10,
      "title": "Stanford Graduate School of Business",
      "category": "learning",
      "format": "clip",
      "durationMin": 15,
      "languages": ["en"],
      "goals": ["career", "learning"],
      "impactScore": 87,
      "why": "Management insights without a two-year MBA.",
      "evidence": "University channel; View From The Top and faculty shorts.",
      "indiaNote": "YouTube. 15 minutes before stand-up, not late-night doomscroll.",
      "url": "https://www.youtube.com/@stanfordgsb",
      "platform": "YouTube"
    },
    {
      "id": "janet-lansbury",
      "n": 11,
      "title": "Janet Lansbury — Respectful Parenting",
      "category": "parenting",
      "format": "clip",
      "durationMin": 12,
      "languages": ["en"],
      "goals": ["parenting"],
      "impactScore": 91,
      "why": "RIE-informed language: connect before correct. Fits Willow’s no-shame framing.",
      "evidence": "Practitioner channel grounded in Magda Gerber / RIE.",
      "indiaNote": "English. Translate the script into Gujarati/Hindi at home: short and proud.",
      "url": "https://www.youtube.com/@janetlansbury",
      "platform": "YouTube"
    },
    {
      "id": "positive-discipline",
      "n": 12,
      "title": "Positive discipline (Parenting Junkie-style)",
      "category": "parenting",
      "format": "clip",
      "durationMin": 10,
      "languages": ["en"],
      "goals": ["parenting"],
      "impactScore": 78,
      "why": "Warmth + limits without humiliation. Pair with Willow daily-care notes.",
      "evidence": "Positive Discipline (Nelsen) tradition — look for Adlerian, not fear-based channels.",
      "indiaNote": "Skip channels that shame children. Search ‘positive discipline preschool’.",
      "url": "https://www.youtube.com/results?search_query=positive+discipline+preschool+parenting",
      "platform": "YouTube"
    },
    {
      "id": "harvard-developing-child",
      "n": 13,
      "title": "Harvard Center on the Developing Child",
      "category": "parenting",
      "format": "clip",
      "durationMin": 8,
      "languages": ["en"],
      "goals": ["parenting", "learning"],
      "impactScore": 95,
      "why": "Serve-and-return, toxic stress, executive function — the science behind Willow horizons.",
      "evidence": "Peer-reviewed synthesis from a university research centre.",
      "indiaNote": "Watch ‘InBrief: The Science of Serve & Return’ then try it at pickup.",
      "url": "https://www.youtube.com/@HarvardCenter",
      "platform": "YouTube"
    },
    {
      "id": "unicef-india-parenting",
      "n": 14,
      "title": "UNICEF India / regional parenting",
      "category": "parenting",
      "format": "clip",
      "durationMin": 8,
      "languages": ["hi", "en"],
      "goals": ["parenting", "health"],
      "impactScore": 89,
      "why": "India-specific early childhood, immunisation, and responsive care — not only Western blogs.",
      "evidence": "UNICEF / MoHFW aligned public guidance.",
      "indiaNote": "Hindi + English. Pair with Willow country pack vaccines.",
      "url": "https://www.youtube.com/@UNICEFindia",
      "platform": "YouTube"
    },
    {
      "id": "mindful-parenting",
      "n": 15,
      "title": "Mindful parenting + Varsity basics",
      "category": "finance",
      "format": "podcast",
      "durationMin": 14,
      "languages": ["en", "hi"],
      "goals": ["health", "wealth", "parenting"],
      "impactScore": 92,
      "why": "Stress down, then money skills: Zerodha Varsity modules (index funds, SIPs) after a 4-minute breath.",
      "evidence": "Mindfulness for emotion regulation; Varsity is a widely used free India markets primer (not advice).",
      "indiaNote": "Varsity first, tips-WhatsApp never. This is education, not a stock tip.",
      "url": "https://zerodha.com/varsity/",
      "platform": "Varsity / podcast"
    }
  ]
}
